{
  "$schema_version": "1.0",
  "meta": {
    "title_ar": "الأشجار والشجيرات الأصيلة في الفلورا العراقية",
    "title_en": "Native Trees and Shrubs of the Iraqi Flora",
    "compiled_on": "2026-07-17",
    "compiled_by": "Claude (Anthropic) — جلسة واحدة، بلا عمليات خلفية ولا استمرارية عبر الجلسات",
    "language_convention": "التنوين يُرسم على الحرف الأخير دائماً (حقاً لا حقًا)",
    "scope": {
      "included": [
        "الأنواع الخشبية (أشجار، شجيرات، شبه شجيرات خشبية القاعدة) التي يُعدّ العراق ضمن موطنها الطبيعي",
        "أنواع مُدخَلة أو مزروعة أُدرجت صراحةً بوسم native_to_iraq = false لأغراض التمييز فقط"
      ],
      "excluded": [
        "الأعشاب الحولية والمعمّرة غير الخشبية",
        "النباتات المائية والقصبيات (Phragmites, Typha) — ليست خشبية",
        "أصناف البساتين والزينة المُستوردة"
      ],
      "taxa_count": 101
    },
    "epistemic_disclosure": {
      "governing_reference_not_consulted": "Flora of Iraq (Guest & Al-Rawi 1966 – Ghazanfar & Edmondson 2016) هي المرجع الحاكم لكنها لم تُقرأ نصياً في هذه الجلسة",
      "completeness": "غير حاصر. الفلورا العراقية تضم مئات التاكسا الخشبية، خصوصاً في Astragalus وTamarix وSalsola وSalix. هذا الملف يمثل العمود الفقري لا الحصر التام",
      "asymmetric_verification": "يمكن لهذا الملف أن يُثبت وجود نوع، ولا يمكنه أن ينفي وجود نوع غير مذكور فيه",
      "iucn_policy": "لم تُخمَّن أي رتبة تهديد. الحقل iucn.verified_in_session يفصل ما تُحقق منه عما لم يُتحقق",
      "local_names_policy": "الأسماء المحلية أضعف الحقول ثقةً؛ كل اسم موسوم بدرجة ثقة",
      "no_national_red_list": "العراق لا يملك قائمة حمراء وطنية رسمية معتمدة للنباتات حتى تاريخ التجميع؛ لذا حقل iraq_local_status تقديري نوعي مبني على أدبيات التدهور لا على تقييم رسمي"
    },
    "key_findings": {
      "no_confirmed_global_extinction": "لا يوجد نوع شجري أو شجيري عراقي مُوثَّق انقراضه عالمياً",
      "the_real_pattern": "المفارقة الحاكمة: أغلب أشجار العراق مُصنّفة عالمياً 'أقل اهتمام (LC)' لأن مداها يمتد إلى إيران وتركيا، بينما تعدادها داخل العراق يتهاوى. التصنيف العالمي يُخفي الانهيار المحلي ولا يعكسه",
      "forest_loss": "الغطاء الحرجي العراقي ≈ 825,000 هكتار (≈1.9% من مساحة البلاد) وفق FAO، و97% منه في إقليم كردستان؛ فقد الإقليم نحو 50% من غطائه النباتي خلال خمسة عقود",
      "oak_dominance": "البلوط (Quercus) يشكل ≈90% من الغطاء الحرجي العراقي، و≈70% من غابات البلوط نوع واحد هو Q. aegilops",
      "no_native_coastal_trees": "الساحل العراقي (خور الزبير/الفاو) لا يملك غابة ساحلية أصيلة. المانغروف Avicennia marina مُدخَل بالزراعة منذ 2019 وليس أصيلاً"
    },
    "field_definitions": {
      "presence_in_iraq": ["موجود", "موجود_نادر_محلياً", "مشكوك_في_أصالته", "غير_مؤكد_الوجود"],
      "iraq_local_status": ["مستقر_نسبياً", "متراجع", "متراجع_بشدة", "نادر_محلياً", "مهدد_محلياً", "غير_معروف"],
      "confidence": ["عالية", "متوسطة", "منخفضة"],
      "habit": ["شجرة", "شجرة_صغيرة", "شجيرة", "شجيرة_شوكية", "شبه_شجيرة", "شجيرة_ملحية", "متسلق_خشبي"]
    },
    "sources": [
      "Ghazanfar & McDaniel (2016). Floras of the Middle East: a quantitative analysis and biogeography of the flora of Iraq. Edinburgh Journal of Botany 73(1)",
      "Guest & Al-Rawi (1966). Flora of Iraq, Vol. 1: Introduction — نظام المناطق النباتية الأربع (عبر اقتباسات ثانوية)",
      "Restor.eco — Iraq tree species biodiversity list (حالات IUCN المتحقق منها)",
      "BGCI — Recovering the Wild: Iraq (مشروع إكثار البلوط في أربيل وحلبجة)",
      "IUCN Red List — تقييمات فردية (Pistacia atlantica, Quercus macranthera, Q. brantii)",
      "FAO / Shafaq News / AFP — إحصاءات الغطاء الحرجي وفقده",
      "Mongabay / Reuters — مشروع المانغروف في خور الزبير",
      "Kurdistan Chronicle / 964media — تصنيف أنواع البلوط الخمسة في الإقليم"
    ]
  },

  "vegetation_zones": [
    {
      "code": "DESERT",
      "name_ar": "المنطقة الصحراوية",
      "name_en": "Desert Zone",
      "description_ar": "الصحراء الجنوبية والغربية المتاخمة للسعودية والأردن وسوريا والكويت. أمطار أقل من 100–150 ملم. غطاء خشبي مفتوح متناثر جداً، سائده مجتمع Hammada salicornica (الرِمث)، مع كثبان رملية وسبخات ملحية",
      "phytogeography": "الإقليم الصحراوي–العربي (Saharo-Arabian)، مع جيوب صحراوية (Saharan) في الجنوب الغربي",
      "districts": ["DWD (الصحراء الغربية)", "DSD (الصحراء الجنوبية)", "DLJ (هضبة الجزيرة الجنوبية)"],
      "woody_character": "شجيرات وشبه شجيرات ملحية وشوكية؛ لا أشجار حقيقية إلا في الأودية والمنخفضات"
    },
    {
      "code": "STEPPE",
      "name_ar": "منطقة السهوب (الجزيرة والسهل الشمالي)",
      "name_en": "Steppe / Sub-desert Zone",
      "description_ar": "نطاق انتقالي بين الصحراء والجبال، يمتد شمالاً وشمالاً شرقياً من جبال حمرين حتى سفوح جبال كردستان. أمطار 150–400 ملم. سهوب مفتوحة شبه خالية من الأشجار، سائدها الشيح Artemisia herba-alba",
      "phytogeography": "الإقليم الإيراني–الطوراني (Irano-Turanian)، بتأثير متوسطي",
      "districts": ["DSD الأعلى", "FUJ (الجزيرة العليا)", "FPF (سهوب السفوح)", "FAR (وادي الرافدين الأعلى)"],
      "woody_character": "الغطاء الأصلي كان سهوباً مفتوحة بأشجار Pistacia وAmygdalus متناثرة؛ دُمِّر أغلبه بالزراعة والرعي منذ آلاف السنين"
    },
    {
      "code": "MOUNTAIN_FOREST",
      "name_ar": "منطقة الغابات الجبلية (السنديان/البلوط)",
      "name_en": "Mountain Forest Zone",
      "description_ar": "جبال زاغروس في إقليم كردستان (دهوك، أربيل، السليمانية، حلبجة). ارتفاع 500–1800/2000 م. أمطار 400–1000+ ملم. غابات بلوط مفتوحة نفضية — وهي الغابات الطبيعية الوحيدة في العراق",
      "phytogeography": "الإقليم الإيراني–الطوراني (شبه إقليم الأناضول–إيران)، بامتزاج متوسطي قوي",
      "districts": ["MAM (العمادية)", "MRO (راوندوز)", "MSU (السليمانية)", "MJS (جبل سنجار)"],
      "woody_character": "الأغنى شجرياً في العراق بلا منازع؛ ≈90% من غابات العراق، و≈70% منها Quercus aegilops وحده"
    },
    {
      "code": "THORN_CUSHION_ALPINE",
      "name_ar": "منطقة الشوك الوسادي وما فوق خط الشجر",
      "name_en": "Thorn-cushion and Alpine Zone",
      "description_ar": "فوق خط الأشجار (1800–2000 م فما فوق حتى 3730 م). أمطار >1000 ملم أغلبها ثلج. شجيرات وسادية شوكية منخفضة، ولا أشجار قائمة",
      "phytogeography": "شبه إقليم الأناضول–إيران (Irano-Anatolian)، مركز الاستيطان النباتي العراقي",
      "districts": ["MAM العلوي", "MRO العلوي", "MSU العلوي"],
      "woody_character": "وسائد Astragalus وAcantholimon وAcanthophyllum؛ حزام انتقالي ضيق فيه Lonicera arborea وCotoneaster وDaphne"
    },
    {
      "code": "RIVERINE",
      "name_ar": "الأودية وضفاف الأنهار والسهل الرسوبي",
      "name_en": "Riverine / Alluvial Zone",
      "description_ar": "ضفاف دجلة والفرات وشط العرب وروافدها وجزرها، والسهل الرسوبي الأوسط. غابات شريطية (gallery forest) وأحراش ضفافية",
      "phytogeography": "متعدد الانتماء؛ إقليم صحراوي–عربي مع عناصر إيرانية–طورانية وعالمية",
      "districts": ["LCA (السهل الرسوبي الأوسط)", "FAR", "LEA"],
      "woody_character": "الغرب/الحور الفراتي والصفصاف والطرفاء — أهم تجمع شجري خارج كردستان، وهو في تراجع حاد بسبب شح المياه"
    },
    {
      "code": "MARSH_SALINE",
      "name_ar": "الأهوار والسبخات والأراضي المِلحية",
      "name_en": "Marsh and Saline / Sabkha Zone",
      "description_ar": "أهوار جنوب العراق (الحمار، الحويزة، الوسط)، والسبخات المِلحية في الجنوب الغربي والجنوب. تربة عالية الملوحة",
      "phytogeography": "صحراوي–عربي مع هالوفيتات عالمية الانتشار",
      "districts": ["LSM (أهوار الجنوب)", "LBA (مصب البصرة)", "DSD السبخات"],
      "woody_character": "الغطاء الخشبي هنا هالوفيتي بامتياز (Halocnemum, Seidlitzia, Suaeda, Tamarix). القصب والبردي ليسا خشبيين ولذا خارج نطاق هذا الملف"
    },
    {
      "code": "COASTAL",
      "name_ar": "الساحل البحري (خور الزبير – الفاو – خور عبد الله)",
      "name_en": "Marine Coastal Zone",
      "description_ar": "شريط ساحلي قصير جداً (≈58 كم) على الخليج العربي. سُهول مدّية طينية",
      "phytogeography": "أطراف الإقليم الخليجي",
      "woody_character": "⚠️ حقيقة منهجية مهمة: لا توجد شجرة ساحلية بحرية أصيلة في العراق. النظام البيئي الساحلي العراقي فقير نباتياً أصلاً. المانغروف الرمادي Avicennia marina الموجود اليوم مُدخَل بالزراعة (مركز علوم البحار/جامعة البصرة، بدءاً من 2019) وليس جزءاً من الفلورا الأصيلة",
      "warning": "أي مصدر يُصنّف للعراق 'أشجاراً بحرية أصيلة' فهو مخطئ أو يخلط الزراعة بالأصالة"
    }
  ],

  "taxa": [
    {
      "id": "FAG-QUE-AEG",
      "scientific_name": "Quercus aegilops L.",
      "taxonomic_note": "أكثر أسماء البلوط العراقي إشكالاً. يُعامل في كثير من الأدبيات الحديثة كمرادف أو قريب من Quercus brantii Lindl. أو Q. ithaburensis subsp. macrolepis. الأدبيات العراقية والكردية تُبقي على اسم Q. aegilops عملياً. اعتُمد هنا بالاسم المتداول محلياً مع تسجيل الخلاف",
      "classification": {"order": "Fagales", "family": "Fagaceae", "genus": "Quercus", "subgenus": "Cerris"},
      "names": {
        "arabic": [{"name": "البلوط", "confidence": "عالية"}, {"name": "السنديان", "confidence": "متوسطة"}, {"name": "الملول", "confidence": "متوسطة"}],
        "kurdish": [{"name": "بەڕوو (Berû)", "confidence": "متوسطة"}],
        "english": ["Valonia Oak", "Aleppo Oak", "Brant's Oak"]
      },
      "habit": "شجرة",
      "zones": ["MOUNTAIN_FOREST"],
      "native_to_iraq": true,
      "presence_in_iraq": "موجود",
      "iucn": {"category": "LC", "verified_in_session": true, "note": "تحت اسم Q. ithaburensis وQ. brantii كلاهما LC"},
      "iraq_local_status": "متراجع",
      "notes": "أوسع أنواع البلوط انتشاراً في العراق ويشكل وحده ≈70% من غابات البلوط. قشوره تُستخدم في دبغ الجلود تاريخياً. جُمع منه ضمن مشاريع الإكثار نحو 35,000 بلوطة لإنتاج 12,000 شتلة في جومان وسوران وهورامان"
    },
    {
      "id": "FAG-QUE-INF",
      "scientific_name": "Quercus infectoria Oliv.",
      "classification": {"order": "Fagales", "family": "Fagaceae", "genus": "Quercus"},
      "names": {
        "arabic": [{"name": "بلوط العفص", "confidence": "عالية"}, {"name": "المازو", "confidence": "عالية"}, {"name": "العفص", "confidence": "عالية"}],
        "kurdish": [{"name": "مازوو (Mazû)", "confidence": "متوسطة"}],
        "english": ["Gall Oak", "Aleppo Oak", "Cyprus Oak"]
      },
      "habit": "شجرة",
      "zones": ["MOUNTAIN_FOREST"],